{
  "schemaVersion": "quiz-v3.0",
  "story": {
    "storyId": "OG0021",
    "title": "Milo and the Lost Color",
    "level": "Level 1",
    "text": "SC01_ST01_N = Milo loves changing colors.\nSC02_ST01_N = But one morning, Milo wakes up gray.\nSC03_ST01_N = Milo walks into the forest.\nSC06_ST01_N = Milo cries by the pond.\nSC09_ST01_N = Milo's colors come back.",
    "scenes": [
      {
        "sceneId": "SC01",
        "sentences": [
          {
            "sentenceId": "SC01_ST01_N",
            "text": "Milo loves changing colors."
          }
        ],
        "emotion": "Happy"
      },
      {
        "sceneId": "SC02",
        "sentences": [
          {
            "sentenceId": "SC02_ST01_N",
            "text": "But one morning, Milo wakes up gray."
          }
        ],
        "emotion": "Surprised"
      },
      {
        "sceneId": "SC03",
        "sentences": [
          {
            "sentenceId": "SC03_ST01_N",
            "text": "Milo walks into the forest."
          }
        ],
        "emotion": "Hopeful"
      },
      {
        "sceneId": "SC06",
        "sentences": [
          {
            "sentenceId": "SC06_ST01_N",
            "text": "Milo cries by the pond."
          },
          {
            "sentenceId": "SC06_ST02_N",
            "text": "Everyone has their own color."
          }
        ],
        "emotion": "Sad"
      },
      {
        "sceneId": "SC09",
        "sentences": [
          {
            "sentenceId": "SC09_ST01_N",
            "text": "Milo's colors come back."
          }
        ],
        "emotion": "Happy"
      }
    ]
  },
  "assets": {
    "imageBasePath": "../v3/OG0021/Image/",
    "audioBasePath": "../v3/OG0021/Audio/",
    "coverBasePath": "../v3/OG0021/Cover/",
    "backgroundImage": "../v3/OG0021/Image/OG0021_Talking_BG_I.png",
    "hintCharacter": "../v3/Assets/BKTK_Characters_Bookey.png"
  },
  "storyGrammarAxes": [
    {
      "key": "setting",
      "labelEn": "Setting",
      "labelKo": "배경 이해",
      "descriptionKo": "이야기의 시간, 장소, 상황적 배경을 이해하는 능력"
    },
    {
      "key": "initiating_event",
      "labelEn": "Initiating Event",
      "labelKo": "사건 시작",
      "descriptionKo": "사건이 시작된 원인이나 문제 상황을 파악하는 능력"
    },
    {
      "key": "attempt",
      "labelEn": "Attempt",
      "labelKo": "해결 행동",
      "descriptionKo": "등장인물이 목표를 해결하기 위해 수행한 행동을 이해하는 능력"
    },
    {
      "key": "reaction",
      "labelEn": "Reaction",
      "labelKo": "감정 반응",
      "descriptionKo": "사건 결과에 대한 등장인물의 감정과 반응을 이해하는 능력"
    },
    {
      "key": "internal_response",
      "labelEn": "Internal Response",
      "labelKo": "내면 추론",
      "descriptionKo": "등장인물의 생각, 의도, 동기와 같은 내적 상태를 추론하는 능력"
    },
    {
      "key": "consequence",
      "labelEn": "Consequence",
      "labelKo": "결과 이해",
      "descriptionKo": "행동의 결과와 사건의 전개를 이해하는 능력"
    }
  ],
  "questions": [
    {
      "qId": "OG0021_V3_Q01",
      "number": 1,
      "type": "story_sequence_drag",
      "storyGrammar": "consequence",
      "instruction": "Put the story scenes in order.",
      "hint": "Think about the story. Milo loses his color and tries to find it.",
      "resources": {
        "images": [
          {
            "id": "SC01",
            "path": "OG0021_SC01_I.png",
            "kind": "image",
            "sceneId": "SC01"
          },
          {
            "id": "SC02",
            "path": "OG0021_SC02_I.png",
            "kind": "image",
            "sceneId": "SC02"
          },
          {
            "id": "SC03",
            "path": "OG0021_SC03_I.png",
            "kind": "image",
            "sceneId": "SC03"
          },
          {
            "id": "SC06",
            "path": "OG0021_SC06_I.png",
            "kind": "image",
            "sceneId": "SC06"
          },
          {
            "id": "SC09",
            "path": "OG0021_SC09_I.png",
            "kind": "image",
            "sceneId": "SC09"
          }
        ]
      },
      "interaction": {
        "promptMode": "drag_sequence",
        "items": ["SC01", "SC02", "SC03", "SC06", "SC09"],
        "correct": ["SC01", "SC02", "SC03", "SC06", "SC09"]
      },
      "scoring": {
        "type": "weighted_position",
        "maxScore": 100,
        "formula": "score = round(sum(weight_i * max(0, 1 - abs(placed_pos_i - correct_pos_i) * 0.5)) / sum(weights) * 100)",
        "components": [
          {
            "key": "SC01",
            "weight": 1.5,
            "rule": "position_distance",
            "correctValue": 1,
            "rationale": "Opening state supports the story arc."
          },
          {
            "key": "SC02",
            "weight": 2.5,
            "rule": "position_distance",
            "correctValue": 2,
            "rationale": "Problem begins; high diagnostic value."
          },
          {
            "key": "SC03",
            "weight": 1.5,
            "rule": "position_distance",
            "correctValue": 3,
            "rationale": "Attempt bridge scene."
          },
          {
            "key": "SC06",
            "weight": 1.5,
            "rule": "position_distance",
            "correctValue": 4,
            "rationale": "Low point and reaction before recovery."
          },
          {
            "key": "SC09",
            "weight": 2.5,
            "rule": "position_distance",
            "correctValue": 5,
            "rationale": "Final result; high diagnostic value."
          }
        ]
      },
      "diagnostics": [
        {
          "code": "consequence_order_gap",
          "threshold": 70,
          "messageKo": "사건의 원인과 결과가 이어지는 순서를 다시 확인할 필요가 있습니다."
        }
      ],
      "lrs": {
        "verb": "answered",
        "objectId": "quiz_OG0021_v3_Q01_consequence",
        "resultFields": ["score_raw", "scene_order", "component_scores", "hint_used"]
      }
    },
    {
      "qId": "OG0021_V3_Q02",
      "number": 2,
      "type": "setting_slot_drag",
      "storyGrammar": "setting",
      "instruction": "Look at the first scene. Fill in the boxes.",
      "hint": "Look at the picture. Who is there? Where is he?",
      "resources": {
        "images": [
          {
            "id": "SC01",
            "path": "OG0021_SC01_I.png",
            "kind": "image",
            "sceneId": "SC01"
          }
        ],
        "scene": "SC01"
      },
      "interaction": {
        "promptMode": "slot_drag",
        "slots": [
          {
            "key": "who",
            "label": "Who?",
            "correct": "chameleon",
            "weight": 2.5
          },
          {
            "key": "where",
            "label": "Where?",
            "correct": "forest",
            "weight": 2.0
          },
          {
            "key": "what",
            "label": "At first...",
            "correct": "loves_colors",
            "weight": 1.5
          }
        ],
        "items": [
          {
            "key": "pond",
            "text": "pond",
            "slot": "where",
            "diagnostic": "후반 핵심 장소를 이야기 시작 배경으로 혼동함"
          },
          {
            "key": "chameleon",
            "text": "chameleon",
            "slot": "who"
          },
          {
            "key": "loses_color",
            "text": "loses his color",
            "slot": "what",
            "diagnostic": "문제 발생 장면을 처음 상황으로 혼동함"
          },
          {
            "key": "forest",
            "text": "forest",
            "slot": "where"
          },
          {
            "key": "loves_colors",
            "text": "loves changing colors",
            "slot": "what"
          },
          {
            "key": "butterfly",
            "text": "butterfly",
            "slot": "who",
            "diagnostic": "처음 만난 대상과 주인공 정보를 혼동함"
          }
        ],
        "correct": {
          "who": "chameleon",
          "where": "forest",
          "what": "loves_colors"
        }
      },
      "scoring": {
        "type": "weighted_slot_match",
        "maxScore": 100,
        "formula": "full slot weight if exact target; 35% slot credit if same category but wrong card; 0 for wrong category",
        "components": [
          {
            "key": "who",
            "weight": 2.5,
            "rule": "slot_match",
            "correctValue": "chameleon",
            "partialCredit": 0.35,
            "rationale": "Identifies the main character."
          },
          {
            "key": "where",
            "weight": 2.0,
            "rule": "slot_match",
            "correctValue": "forest",
            "partialCredit": 0.35,
            "rationale": "Identifies the story place."
          },
          {
            "key": "what",
            "weight": 1.5,
            "rule": "slot_match",
            "correctValue": "loves_colors",
            "partialCredit": 0.35,
            "rationale": "Identifies the opening state before the problem."
          }
        ]
      },
      "diagnostics": [
        {
          "code": "setting_slot_gap",
          "threshold": 70,
          "messageKo": "인물, 장소, 처음 상황을 나누어 읽는 연습이 필요합니다."
        }
      ],
      "lrs": {
        "verb": "answered",
        "objectId": "quiz_OG0021_v3_Q02_setting",
        "resultFields": ["score_raw", "slot_values", "component_scores", "hint_used"]
      }
    },
    {
      "qId": "OG0021_V3_Q03",
      "number": 3,
      "type": "listen_scene_mcq",
      "storyGrammar": "initiating_event",
      "instruction": "Listen. Which scene starts the problem?",
      "hint": "A problem is a bad change. Listen for Milo's bad change.",
      "resources": {
        "images": [
          {
            "id": "A",
            "path": "OG0021_SC02_I.png",
            "kind": "image",
            "sceneId": "SC02"
          },
          {
            "id": "B",
            "path": "OG0021_SC03_I.png",
            "kind": "image",
            "sceneId": "SC03"
          },
          {
            "id": "C",
            "path": "OG0021_SC06_I.png",
            "kind": "image",